,issuekey,title,description,storypoint
0,MDL-1626,Forum: Per-discussion subscription,finding absolutely flooded unwanted moodle forum script annoying know similarly annoy fact put system problem unlike discussion moodle entire forum thread overwhelming people serious business could said moodle generating feature unfocused chance going please,100
1,MDL-3714,Forum: Reply by e-mail,ability post via,100
2,MDL-5583,allow teachers to specify certain fields in database activity as required,allow teacher specify whether field must filled,20
3,MDL-8501,Forum: proceed to next thread link,please put link jump next thread forum interface cool evaluation process time consuming teacher time everything,20
4,MDL-10115,A use profile's course list is arbitarily limited with no way of seeing complete list,user profile list think ellipsis displayed bit useless click ellipsis see rest b list even alphabetic order becomes even arbitrary c ellipsis easy miss may list truncated suggest either making work properly e ellipsis list considered important put many show certain amount would seem sensible display alphabetic order without difficult administrator see user example role,13
5,MDL-12403,backup or import of single quiz includes all questions in database,making backup individual matter many back backup question bank used quiz backing extreme case back single quiz restore another course unintentionally transfer along quiz quiz another course,100
6,MDL-13114,Include bulk course create and remove with Moodle through the use of CSV files,looking moodle replacement blackboard enterprise order moodle viable replacement need way bulk create delete based bulk create handled use party module rory however import say way bulk remove end semester removing would time consuming would really prefer functionality included within moodle party matter good risk module getting,100
7,MDL-16073,"Add ""test database setup"" to the ""External Database"" enrollment and authentication plugins",hard test whether administrative panel external authentication external enrollment correctly currently create fake user similar try authenticate enroll see receive least tested someone better way nice test connection button page go sure password connection data correct stuff screen easy read report thank,4
8,MDL-16474,Allow single-item scales,single item scale useful used moodle demand see moodle forum discus currently scale may,8
9,MDL-16982,Adding data mapping for custom user fields,like possibility add data custom user use,40
10,MDL-17081,"Implement import/export ""Permissions"" settings for ""Manage roles"" tab",suggest implement import export role see two probably one need particularly useful enterprise level moodle implementation often staging testing development moodle role pain butt manually change one one long list newly moodle thanks,20
11,MDL-18014,Automatically and periodically save WYSIWYG editor content as a draft/concept,discussion shortly use automatically periodically every minute save content editor space see working example could use table therefore flag rich text field feature every identifier accessible maybe via card lifetime subject configuration couple default,40
12,MDL-18229,Add grade item and student grades quick edit feature to the grader report,add grade item student quick edit feature grader report enable grade item student feedback grade thanks feature see moodle forum discus,100
13,MDL-18375,Displaying and selecting dates throughout Moodle should allow the use of multiple calendars,patch add capability working calendar provide apply patch following post,100
14,MDL-18633,User profile: add last ip field to user view,similar request add last address could useful site administrator trying track user last access moodle patch attach come one head well peace,2
15,MDL-18770,Non-graded Assignment and Quizzes appear in the gradebook  and have Max Grade assigned,non graded assignment getting displayed look like included aggregation cat interface since grade value set behave definitely e g forum graded appear column behavior add assignment set grade column still appear go cat interface display grade column though actually included calculation add assignment set graded scale scale included aggregation u maximum grade cat interface display number e g scale since one would expect calculated toward course category total add quiz add make quiz worth maximum grade cat interface still interestingly enough manually delete column kind quiz delete column way add back even though make quiz gradable think related,13
16,MDL-20045,Add unofficial support for custom context levels,issue reference moodle forum discus brief one moodle would benefit greatly able use moodle system would need define context however would like able without differ core unmaintainable way believe would helpful many moodle may help improve readability core moodle code,40
17,MDL-20250,"Add admin settings for disabling particular gradebook calculations, category overriding and grade minimum on the grader report",setting aggregation available added moodle multiplicator offset see exactly added moodle,40
18,MDL-21180,Category children default to extra credit when category agg is switched from Weighted to Simple,category set weighted mean assigned category method switched simple weighted mean extra credit supposedly fixed took account item category entire category switched common,40
19,MDL-21415,Course Participation Report doesn't abide by separate groups,tested participation report non teacher group set separate non teacher set prevent log non teacher set go course click participation report choose activity set show student student show participation report also respect separate,20
20,MDL-21469,Chat window uses browser language rather than preferred language set in profile,reproduce set browser language say dutch login moodle net access moodle net chat view id click enter chat result text chat window preferred language set profile actual result text chat window dutch,3
21,MDL-22236,Design way to send files by web service (upload),find way send draft file area moodle use web service original issue description quote sending hub currently work design token post request talking conclusion sending web service probably script file big biggest order sent write new file web service design could need follow design quote,40
22,MDL-22669,Moodle bug with course restore section count,course import restore source course create increase non sent section,8
23,MDL-23646,"TinyMCE can't be resized and doesn't scroll for wide content, especially on small screens",page think one saw screen small dragging handle cut whole thing pretty well useless see example idea something fixable setting default width editor based width browser thought mention anyway replication log navigate site appearance site selector choose theme right navigate course create page resource reduce size browser window note effect editor result editor covered right actual result right edge editor,20
24,MDL-24120,Allow admin to remain logged in after login as procedure,log moodle go course home page enough block select student login something least nothing return personal account end process always logged,20
25,MDL-24287,Convert group members selector to Shifted YUI3 module.,working think good idea convert group user object rather set within page make code clearer help improve sam,13
26,MDL-24343,Properly deprecate unzip_file/zip_file,sam related recent commit code base found couple used question format format peace p perhaps create meta issue part code clean,3
27,MDL-24380,Chat: autoscroll help popup incorrect and doesn't display fully (it only concerns the alternative chat methods),help chat rather feature,3
28,MDL-24775,a pagedown key press in any tinymce editor destroys entire page layout,page editor kill layout maybe almost page moodle,20
29,MDL-25473,Embedded MP4 videos via linking to the course file loops when finished playing.,embed video like code file code automatically finished happen went moodle folder filter find every occurrence word loop change true false went back video added tag link code param name loop value false code video stopped,5
30,MDL-25544,Improve Grader report user interface,issue large one improving usability accessibility moodle grader report touch screen moodle working group met june determined number key detailed specification moodle dev still finished nutshell expect full screen like display well static quickly reduce information dealt link row column speed,100
31,MDL-26170,Deleted Forum & Blog Posts in RSS Block,moodle even forum post show block even run exploit,8
32,MDL-26244,'Choose a link' for database URL field gives confusing message,going add edit record user lot choose link button problem button completely useless file picker page call file sound like sorry none available repository may return external please take button,8
33,MDL-26408,IMS Enterprise admin notifications fail on message_send(),error error must fixed programmer could load preference component name match row message must appear configure notified receive blah stack trace line thrown line enrol call line call line call look like,2
34,MDL-27158,Default timezone is incorrect when not set in PHP configuration,date set server configuration moodle base default set administration area say time half hour fast date set server configuration issue problem still thinking base moodle current time value moodle go display time e assignment conditional access time incorrect time server local time work fine issue either however moodle set use server local time user manually incorrect might related little different,20
35,MDL-27339,"The link Create ""File system"" instance do not work",defined user add repository user context user create file system instance link get permission screen left left side middle right side view,5
36,MDL-27953,"Upload users option only allow the following authentication options: Manual account, or No login",file choose authentication drop following manual account login x get following authentication manual account login server based self registration,8
37,MDL-28162,[ERROR] Automated backup status,backup continue receive summary error unfinished saved see save unfinished look like course time taken status next backup unit may unfinished may student council may unfinished may staff room may may may may error may chap may may may unit may error may functional skil group year year year error german try look detailed backup course get message detailed execution log course found,100
38,MDL-28448,Teachers cannot delete user submissions - advanced uploading of files,ability delete well revert status draft x teacher deletion possible,20
39,MDL-28631,forbid use of cookies especially from javascript,theme keep smuggling compatible privacy simply stop necessary use user data model repository anomaly theme solution educate see user fix code fix dev,40
40,MDL-29070,Clean enrol_imsenterprise following coding guidelines,enrol one worst seen moodle loop think would great perform general cleanup consideration dev x stable note right file master sending stable backlog initially,3
41,MDL-29441,Chat window does not pop up for separate groups in IE7-9,separate click enter chat nothing select enter chat replication setup go chat group mode separate upper left corner select group try enter chat,4
42,MDL-30195,Export forum discussion without attachments to google docs portfolio,got portfolio moodle site want export forum discussion forum post within discussion export work flawlessly soon forum post within discussion attachment mainly image whole discussion nice meaningless error message saying common available portfolio calling location b single post available portfolio would possible improve export forum discussion regardless attachment user least discussion text,20
43,MDL-30431,Attempting to edit wiki comments from another user causes an error,replication user student role comment user b teacher role edit user comment user b save comment error must fixed programmer invalid state state state moodle en error user able edit comment quite happily,13
44,MDL-30668,Prevent the grader report from storing serialized data in the user_preferences table,see grader report array table table really simple name value would good could avoid data instead human readable data,20
45,MDL-30812,Latest backup files generate error/setting_invalid_ui_label upon restore,staff unable restore recently course backup prior upgrade backup file new course even since upgrade restore process go upon pressing restore error upon pressing continue course showing invisible course process never upgrade latest moodle version alleviate error problem creation backup file since upgrade generating error prior still successfully,20
46,MDL-30839,form validation and error recovery,better mechanism need used help identify form text page invalid submission easily found screen reader several improving error recovery basic premise either automatically set focus error message usually used server side validation use aria notify user error message usually used client side validation provide enough detail error message user error provide link within context error message allow easily jump form tutorial error recovery error technique mechanism jump,20
47,MDL-30852,user report grade view has inaccessible table,table used display user report grade view complex data table thus need explicitly attached correct data complex data table mean single set across either example simple data table view scope attribute table data correct way implement complex data table view id table data id,8
48,MDL-30895,provide easier chat reading for screen reader users in accessible chat activity,accessible version chat activity accessible could usable way navigate discussion bit cumbersome listen screen reader use definition might better store chat table three column one would header column include poster name column would message column would time stamp would allow screen reader simply navigate second column easily hear pertinent information person name message current definition semantically correct quite verbose cumbersome navigate screen reader,13
49,MDL-31089,New posts listing on 'My Moodle' ignores groups.,seeing x since last login course overview moodle even belong access presumably get notification new able see replication create course forum set separate create two enrol post something one group forum log student group see post since last login message subject course overview,40
50,MDL-31356,IMS Enterprise enrol plugin added features,added following enterprise enrol ability update course full name ability update course short name ability create course creation ability update user record already knew except ability set update authentication type user creation added area turn course user set separator character,40
51,MDL-31379,Introduce new grading fields - dategraded and datesubmitted,could possibly new grading make grading easier note grade code hack create new code,5
52,MDL-31410,PayPal IPN Script exposed to message_send() failure,issue resolution merely need marked fixed main development branch script part enrolment method function cause entire enrolment method fail script payment script various regarding transaction script handle connection received student accordingly student via call connection various people work fine start getting failure warning history see list server moodle response happening people step failing script product failing server process would seem time cause web server return since step end moodle getting need however tolerate long automatically causing fail entirely solution really simple use wrapper function call try catch block execution whatever whole experience believe issue another matter may merely misconfiguration thing though send u successfully guess depending function attached version hope immediately main development branch probably affecting even people issue personally across wide range x moodle fixing run weekly someone else would fix push came shove thus fixed,3
53,MDL-31501,"New session infrastructure - file, database and memcached storage ",session handling important performance code hopefully good enough added core edit ticket session handler instead,100
54,MDL-31560,New message_send API is incapable of sending notfications from the $CFG->noreplyaddress.,old could need able many code currently use future please extend make possible old system able set fake name go beside example might get shy user moodle example forum poster decided want keep private quiz system moodle code think use important need see hard around time table guarantee sent synchronously message output address message table null default column note issue different,8
55,MDL-31597,"In User Report, Weights should not be displayed as a percentage",display grade user report grade book displayed incorrect used grade administration course grade user report set show show assign grade shown following,13
56,MDL-31625,Overfilling DB entries with a replace causes error,column constrained limit like replace new search fail error writing information error error value long type character update set replace array moodle stack trace line thrown line call line call line call execute line replace call ilicic made function fix running running replace command search update another row old row usable effectively doubling size greater original making column column data update fail replace greater search replace search column equal greater size search,13
57,MDL-31776,"Additional name fields, to allow Asian languages to flexibly display user names in Chinese characters, local phonetic system or Romanization",alternate name proposal behalf moodle association japan willing work closely moodle improvement help providing development standard moodle two use different writing system two need displayed name local writing system name moodle need way input individual administrator perhaps course level determine appear various moodle ideal configuration propose three additional standard usage would perhaps writing various possible would look like alternate site administrator would select variable would appear example administrator might select alternate would appear following would allow everyone know name pronounced even need since alternate example could read depending preference user family combination could also selected default user appear various table selected table one phonetic rather standard alphabet display filtering list first name last name similar selection display would appear selected alphabetic system selection would also need made phonetic system use system china system student id display many another problem much west people identical plus fact namely convenient method rely student id rather addition thus also option site set field displayed left various grade book assignment evaluation complexity time problem quite complex since core code perhaps table preference would need done close moodle headquarters would benefit improvement probably every institution staff read local language need able display local language various rather unsatisfactory ad currently used permanent elegant solution urgently,100
58,MDL-31830,Replacement for the course and category management pages,issue look possible replacement course category management within moodle management system currently getting pretty antiquated could really make could greatly streamlined get desired common onto would also great process moving could simplified likely enhancement could help think loading drag drop,100
59,MDL-31989,Global Search 2,global search currently removed moodle part project written global search implementation current dev master branch may view play global search password moodle dev,20
60,MDL-32275,enrol/users.php shows last access to the platform but not last access to the course,view enrol course specific enrolled course nevertheless field last access time user last platform although never course last course access much one field user last course,8
61,MDL-32450,DragMath GPL issue,jar jar file distributed moodle source code available go,8
62,MDL-32570,"Deleting ""Miscellaneous"" category broke the ability to use IMS Enterprise to create courses",miscellaneous category moodle ran enterprise script incident similar tracker moodle browse posting moodle forum discus remove one section script really term tag course category fine miscellaneous category script without problem empty course name spring name category miscellaneous category real spring category know version,2
63,MDL-32592,Category Undefined in IMS Enterprise,hi line enrol script category string longer however category empty result error notice undefined property category enrol line serious matter small bug easily fixed different statement empty group category provide patch necessarily best,2
64,MDL-32746,User login - trigger event,would possible add user login event event could triggered function user,3
65,MDL-32862,Links to some 1.9 resource types break after upgrade to 2.2 followed by backup and restore,reproduce create moodle course resource following type text page web page directory topic course text course create link resource upgrade moodle instance moodle point find link still work point resource view redirect correct moodle page view create backup file course restore backup file new course result link course work point resource view page show error message invalid course module id,13
66,MDL-32917,Upgrade dateselector to use YUI3 calendar module,form still calendar able convert calendar relatively easily,13
67,MDL-33057,Rewrite DND Upload to YUI module (performance),something would really nice given much course converted really well keep clean sam,100
68,MDL-33343,Unable to create a new page in wiki,problem running latest although reproduce computer create new page following error code default exception handler error writing duplicate entry key insert array n n n n line thrown line call line call line call line call line create call moodle view id code,5
69,MDL-33600,There is no checkbox to control sending feedback when grading an assignment,previously gave marker option send feedback grading assignment longer honest think option necessary recording absence sake consistency,8
70,MDL-33618,A way to hide messages that were configured to never be sent,user view sent via recent profile even user receive forced receive way suppress never actually user,13
71,MDL-33741,Teacher can't access course files in hidden categories using the Filepicker with the server files repository ,replication login administrator create create two one category assign teacher create file resource file course hide one login teacher enter course visible category create file resource click add file button access file picker select server repository click system access root result course hidden category listed try able see course,4
72,MDL-34055,Database function for fast bulk inserts,large number quite slow hundred per insert done testing found possible get performance boost multiple one query syntax insert table written generic function bulk quote insert multiple table batch insert syntax speed param string table table inserted param iterable object array inserted table return true error public function table quote function query either maximum query length maximum record count insert building fresh query pas whole array avoid data inserted memory although work simple finding quite make work field think core might wondering would interest getting core,8
73,MDL-34161,Fix LTI backup and restore to support course and site tools and submissions,discovered handling information backup restore especially related pointing course site far perfect also handled issue fix backup restore support information,1
74,MDL-34182,Invalid JSON output on filepicker when repository plugins output invalid content,moodle tried restore backup moodle select small backup file run file picker select one say file picker error dialogue box come invalid script turned found following script message invalid string fatal error memory size exhausted tried allocate home line checked code following sure go next create curl instance curl curl cache ret cache get return ret else ret curl cache cache set ret curl error curl echo return data ret echo echo error error curl empty error return ret else return error exception friendly throw new error curl anyone help get sorted please tried help found thanks,8
75,MDL-34209,Moving sections by drag and drop causes the sections to be reordered,move course sometimes reorder randomly bunch added content added section end plus icon tried drag drop location higher page section drop new location actually section random location reorder randomly well every time try reorder section,20
76,MDL-34248,Restoring a course fails at mdl_log insert,tried restore course new course following message log default exception handler data long column row insert time module action course array forum search search id search ce line thrown line call line call line backup call line backup plan class call line backup helper class call process line backup parser class call line backup helper class call line backup parser class call line backup parser class call line backup parser class call line backup parser class call publish line call line backup parser class call line backup parser class call parse line backup plan class call process line backup plan class call execute line backup plan class call execute line backup plan class call execute line backup controller class call execute line backup class call line backup restore call execute backup restore tue error client potential error found must server backup restore,13
