,issuekey,title,description,storypoint
507,MDL-42289,Automate MDLQA-57 - Past chat sessions can be made available for everyone to view,past chat session made available everyone view,41
508,MDL-42292,block.version regression in custom lang tool,error column version exist line select version name select version name array error code stack trace line thrown line call line call line call line call line call line call line call line tool call line tool index call,1
509,MDL-42293,"Behat upload step, should be able to determine proper location if ""admin/"" is present in the url.",step able determine proper location present,5
510,MDL-42317,TinyMCE editor can overlap with Blocks on New Event Page in Calendar in Clean Theme,see attached thought bug essential first far right usually right really wide browser window clean essential,20
511,MDL-42330,Automate MDLQA-5257 - An admin can award a site badge,award site badge,3
512,MDL-42331,Automate MDLQA-5258 - A teacher can add and allocate a course badge,teacher add allocate course badge,3
513,MDL-42332,Automate MDLQA-5260 and MDLQA-5261 - A badge can be awarded based on activity and course completion.,badge based activity course completion feature file background section,5
514,MDL-42339,Remove double formatting set_title/set_heading over codebase,page page already process content call type page least page least context match current page context set set passing parameter page page explicit search destroy incorrect looking carefully context always set,13
515,MDL-42340,Long help texts overflow in help tooltips,course add new badge make sure local site see warning site accessible site cannot external help icon click help icon render properly tracker moodle secure attachment bonfire,2
516,MDL-42342,Alternate name warnings in quiz results block,error course view page block displayed code need update include additional name user object line call line call line class call line class call line call line call line call line theme clean layout call line call include line call line course view call header code,3
517,MDL-42356,Edit PDF: When no stamps uploaded toolbar looks strange,strange line right hand side,1
518,MDL-42360,Edit PDF: On-screen layout does not match PDF layout,something took long time get exactly right original see attached layout comment border style different gray curved black square screen layout quite bit screen taller screen font size,13
519,MDL-42377,Incorrect debugging message in backup.,backup transformer message incorrect backup transformer process plain content always backup transformer process plain content,2
520,MDL-42381,remove unused OLE lib and pear excel leftovers,see,3
521,MDL-42386,Etag verification for stored files never matching,innocent testing discovered verification last verification consequently matching ever see point issue fix matching stable big impact heavily forum long long rest code base revision approach affected case recommend review case anything,2
522,MDL-42387,Revisit CFG->filelifetime implementation and uses,innocent testing discovered used often desirable see point issue consider could better apply new approach everywhere perhaps may sense move within continue arbitrary set precedence perhaps precedence another force smaller accepted trick decide behavior help wanting put longer wanting use small testing observing many possible set,5
523,MDL-42390,User name (first/last) not properly scrubbed,first last name properly scrubbed non form input display content style,13
524,MDL-42392,Block content doesn't show when the content was hidden and javascript is turned off,possible unhide block disabled result block hidden per user preference cannot unhidden user since turned either add show button page unhide content disabled vote latter think try encourage disable,3
525,MDL-42393,Calendar events blinks,calendar month block hovering quickly blinking never moodle exact problem tested multiple really disaster work properly box really annoying bug thanks advance,13
526,MDL-42405,EditPDF: when the PDF has a wrong format then a TCPPDF error is displayed in a blank page.,previously displayed wrong format blank page attached file bad format,1
527,MDL-42414,One more time() random failure: test_increment_revision_number,follow already tested new random failure recently code equal greater master master class code fix new least move time early test random second happen middle,2
528,MDL-42421,Remove incorrect statement in auth/upgrade.txt,commit new incorrectly actually exist,2
529,MDL-42428,Update M.util.show_confirm_dialog() to use moodle-core-notification,confirming confirm form quiz completion converted moodle dialogue,20
530,MDL-42429,PHP notice regarding undefined property displayed when editing a lesson,add lesson course click edit lesson get notice notice undefined property version moodle lesson line global module variable longer version check really unnecessary know module version going le stated removing,5
531,MDL-42433,No longer able to annotate pdfs in 2.6 beta,dev site moodle build longer annotate see launch link also tried master site cannot annotate either understand annotate removed always present able edit cannot reproduce create assignment one file student log back teacher click assignment view grade click grade assignment obvious way annotate directly,3
532,MDL-42438,new emulated simpleyui rollup does not load CSS for extra modules,need load following list theme use everywhere escape attribute core event custom complex,5
533,MDL-42440,Cannot enable most authentication plugins,authentication manage authentication page cannot link action enable b link action enable paste change name working enable disable link always always work,1
534,MDL-42442,eliminate standardwhite references in lib/setup.hp,ensure valid theme set theme theme,1
535,MDL-42461,Creating a wiki in group mode triggers setType warning,visit course create set group mode separate view get following notice remember call cleaning,5
536,MDL-42465,Beeping user in chat causes strict standard warning,visit section set chat method normal method visit course create chat activity view activity click enter chat click name see message obviously vary depending site directory location strict default object empty value moodle chat line,3
537,MDL-42467,Deleted Database and Glossary entries in RSS Block,removed feed probably glossary check discovered testing,8
538,MDL-42481,Clicking in text area fails to shift focus,add workshop course expect multiple text creation form problem add name description open assessment area form click text area assessment focus shift text area click button editor focus shift,13
539,MDL-42493,"Upgrade to current 2.6beta, memory exhausted problem purging caches",site upgrade current got error code fatal error memory size exhausted tried allocate cache file line stack trace main upgrade upgrade cache class helper purge cache class helper cache file code many purging lot memory consider increasing upgrade alternatively perform purging increasing memory upgrade think former better general covering purge,2
540,MDL-42496,backport MDL-41245 add-on installer redirection fix from master,finally resolve problem missing,5
541,MDL-42497,orphaned subplugins are missing on the plugins overview page,probably add new sub via missing,8
542,MDL-42512,Missing filters are displayed in the filters administration,testing discovered missing still displayed list could even enable disable missing link work missing moodle view,5
543,MDL-42525,improve perf of core_plugin_manager::get_plugin_info(),need load everything load one type,3
544,MDL-42541,Refactor portfolio queue system to prevent usage of events_trigger(),portfolio queue system old order register job code get rid usage,20
545,MDL-42547,Bulk users upload: values are not trimmed in CSV file when bulk uploading users,bulk file whole reason clean contain space end beginning moodle resulting impossibility send user best approach would strip beginning end potentially,8
546,MDL-42553,It is not possible to uninstall calendar types,install calendar type moodle go notice calendar type,5
547,MDL-42575,Revert heading option display for page resource,tracker moodle browse page system comment comment back heading display option page resource,8
548,MDL-42585,Refine capabilities that permit user to see assignments and the user feedbacks without ability to grade,often get request provide tutor role would capable user feedback within course without able grade would like new capability added assignment module code way separate ability view without able grade new capability could assign would affect among assign assign assign,20
549,MDL-42588,Add option to Scorm setting to display or hide activity name,discussion option display hide activity name currently option option could used prevent duplication heading display page discussion also moodle forum discus draw back possibility losing page hierarchy level heading user screen reader assistive technology use header page structure navigate web page also forum discussion get feedback community moodle forum discus,5
550,MDL-42597,New maintenance mode countdown counts down to 0 instead of 1,enable new maintenance mode u apache maintenance top every moodle page maintenance mode unfortunately message message box instead last minute maintenance mode activation rather message saying site switching maintenance mode would like propose add function solve cosmetic issue,13
551,MDL-42612,add Russian Ruble to list of paypal currencies,ruble rub,1
552,MDL-42682,Fix display alignment and content for forum discussion in Clean theme,mobile device width discussion list screen discussion page display moving discussion left alignment instead right alignment,3
553,MDL-42748,Help dialogue no longer handles long help texts,working content help dialogue long content truncated presumably scroll bar something,3
554,MDL-42752,Disabled icons on file picker still get focus resulting in them being read out by screen readers,focus disabled screen reader reading user even though additional part issue would good look alt title attribute see way improve also used escape,20
555,MDL-42767,Notes for deleted courses causes error,note added user course level user page course error note page course found replicate enable user site browse list user enrolled class navigation menu choose one choose add new note add note leaving course context save delete course added note go back user note page find data record table course information error select course id array error code stack trace line thrown line call line index call,13
556,MDL-42797,Guest access displays exception error right after upgrade process,trivial error impact low amount people install login set user profile done already upgrade web connect guest soon click guest button see attached connected finish validate upgrade guest access back working,2
557,MDL-42801,Drag and drop upload of resources doesn't add action icons correctly.,reproduce go course turn drag drop file move displayed action menu added next line menu width le text overflow,5
558,MDL-42834,Deprecate loginhttps,opinion time removed setting sealed potential leak removed three ago net bug two primary broke login time link present page moodle login issue always setting current schema however would really super nice could login feel forced use throughout site strong used hardware performance far better five ago proven easy steal session non en longer theoretical even hard far widespread already load additional content e g image actual page content longer third party supporting e g like propose drop support documentation moodle en apache,40
559,MDL-42882,Performance improvement to missing root directory upgrade step,update process version fix missing root folder file upgrade line find missing left join used really large table update point attempt get work maybe people problem code select distinct component component user draft array user id time time r root folder entry count array r component r component r r count continue root folder entry r r component r r array r array close main true code,20
560,MDL-42884,Can not delete users with invalid emails,given invalid information error error code stack trace line user thrown line call line user call,5
561,MDL-42885,Updating existing users via bulk upload causes debugging messages,master could find user line tool index call could find user line tool index call could find user line tool index call could find user line tool index call could find user line tool index call could find user line tool index call could find user line tool index call could find user line tool index call could find user line tool index call,8
562,MDL-42889,Remove access to old log table in admin/handlevirus.php and other clam related code,currently library legacy logging table need use new logging,2
563,MDL-42890,Reimplement access to log table in backup/util/helper/backup_cron_helper.class.php,currently class legacy logging table need use new logging,13
564,MDL-42891,Reimplement access to log table in functions notify_login_failures() and count_login_failures(),currently legacy logging table need use new logging,20
565,MDL-42892,Reimplement access to log table in function can_delete_course(),currently function legacy logging table need use new logging,20
566,MDL-42894,Investigating performance of the new logging API in practice,new logging place performance impact need measured reduce impact new logging system,20
567,MDL-42896,Grade update event,multiple make grading table generic event class something use instead multiple thing see,20
568,MDL-42898,Develop a timeline page/block,new logging system place possible implement page block user see stream activity relevant individually target information could used home page,100
569,MDL-42904,Self enrolment by group key does not work - until group settings are saved again,customer running moodle setting group enrolment checked configuration correct user self enrol one correct group key receive error incorrect enrolment key please try key correct tested weird thing go page select relevant group choose edit group press save without anything user self enrol group key properly saved first time set although key certainly saved click unmask correct key displayed customer go whole site save every group every course cannot find anything wrong site configuration self enrolment configuration group configuration bug although happy proved wrong long explanation behaviour forthcoming appreciate someone taking look matter urgency arrange access site server,8
570,MDL-42909,Move (non-JS): title attribute is on wrong tag,moving non version move written code like following code li class first title move discussion location open course class open theme image core title move alt move li code see title attribute li tag make lot sense link tag additionally unnecessary title attribute tag previous code code title move discussion location open course class open theme image core alt move code code correct title attribute tag full text alt attribute title tag accessibility none suitable anyway link different longer text name item actually help still accessible solution would use text like move item week study describe item probably know included section name target location relative position within section sure whether worth anything know moodle stop supporting non graceful degradation thinking fixing regression back right attribute right tag since inaccessible even always think going bother probably filing bug leave moodle staff decide sorry code title li course renderer currently line,5
571,MDL-42924,use normalize_component to extract plugin name and type,file moodle function function component line list type explode component block two membered name variable substituted set look like list type component,5
572,MDL-42928,Reimplement scroll locking for full-screen dialogues,serious usability issue many contain content open attempt scroll find page whilst major issue predominantly touch predominantly swipe get list find whole page move bottom top list case activity chooser serious regression patch scroll locking different method rather removing instead set dialogue every scroll event dialogue closed stop forcing scroll release control back user,100
573,MDL-42931,Decide Moodle 2.7 requirements and push them to environment.xml,need decide moodle put environmental time change version various replace new one corresponding get list r look status unify,13
574,MDL-42934,Self registration does not use site language setting,visit tool index install new language pack visit section set default language one visit section set self registration based self registration register new user site log user notice user setting set default rather site language setting,5
575,MDL-42935,"user_create_user and user_update_user functions do not validate auth, lang or theme",function new include manual new language code en must exist server theme new theme name standard must exist server however none like function,13
576,MDL-42956,mnet broken for mssql and oracle,looking recent limit clause automatically oracle moodle moodle blob master since ago need fixing,13
577,MDL-42962,create a course_module_viewed abstract class,need abstract class,8
578,MDL-42973,Unknown component location,login moodle go directly moodle index error error must fixed programmer unknown component location problem go update curl error copied error unknown component see error even clean install moodle cache session,40
579,MDL-42980,Clean: Activity chooser's Add/cancel button on iPhone4S does not respond,safari add cancel button respond bottom barely instead bottom navigation bar couple random forcing activity chooser scroll work work fine chrome,8
580,MDL-42983,Clean: Custom menu and login info does not appear on small screen,custom menu login appear safari chrome though saw appear never,20
581,MDL-42993,Username with spaces no longer valid for LDAP authenticated users,authentication tied ad network receive given invalid message trying log moodle first time configuration worked previously difference password manual used insert user record function validation allow extended user name set need set following moodle code true code,13
582,MDL-42995,Restored course has broken links in assignment description when viewed from calendar event,assignment description file link file assignment calendar block due date file link file course backed new course reproduce create course add assignment add file e g image description create link description resource e g document set due date assignment add calendar block course backup course restore elsewhere site sure include user data enroll user course enrolled user load assignment course file link work still enrolled user go back course page use calendar block click due date assignment link image link assignment description broken result description broken since assignment description assignment page correct calendar page also correct actual result assignment page correct calendar page broken link,8
583,MDL-43005,tag param in blog index page should be strictly checked,code select tag name false array tag code error like code error found one record line call line index call code two similar example tag,4
584,MDL-43008,Calendar plugins can not display setting pages.,new calendar currently allow addition standard calendar may fine calendar may require certain,10
585,MDL-43010,Create expand/collapse in the X steps for behat,create expand collapse x wrote use one later decided need someone else benefit,5
586,MDL-43028,Site admin navigation is not expanding on few pages,default home page navigation expanded displayed,8
587,MDL-43037,Quiz user overrides generates alternate names debugging message,need update include additional name user object line call line quiz call line call definition line quiz call line quiz call,5
588,MDL-43044,The course_module_instances_list_viewed abstract class could be improved to do more.,see,13
589,MDL-43058,report_security_check_riskxss reports additional name fields in the user object.,need update include additional name user object line call line report security call line report security index call fix code title report security detailed select distinct u id u u u picture u u select distinct code,3
590,MDL-43062,"Content of label is left-aligned, regardless of alignment chosen ",center right align text label correctly editor always left displayed course page prior used able content center right course page,8
591,MDL-43063,Function download_file_content() inline documentation of return value incorrect,function return mixed content file string actually response object status error,3
592,MDL-43106,Moodle 2.6 sends 2 Set-Cookie headers,since moodle sending set different usually setting multiple name would result may bug also work moodle activity resolved example directly moodle date server apache vary front end accept user agent set path secure mon cache control store cache must revalidate cache set path secure content language en content script type text content style type text x compatible ie edge cache control post check check last accept none x frame transfer content type text addition local,3
593,MDL-43117,Add release column to Plugins Overview page,would beneficial able see release version number overview page realize core moodle release version file party provided possible solution code repository branch moodle,2
594,MDL-43137,class loader breaks open_basedir,looking class component function quick check parameter valid calling unfortunately like class trigger restriction cause moodle fail would better comparison see like valid absolute path moodle forum discus,2
595,MDL-43140,When submitting the form on the mnet access control page a warning is shown,visit put form choose set allow submit see following really redirect start page output line call line call line call redirect,2
596,MDL-43142,No username variable passed to mnet access control string,visit enter form select remote deny access control next page click link allow next deny user notice missing variable next screen allow user user,3
597,MDL-43167,Frontpage should support the same JavaScript as course pages,support course drag drop,40
598,MDL-43171,Cleanup and fixup of the events/logging docs,looking doc example moodle dev moodle dev pattern new wrong relationship column make sense also since new provide exact detail evaluation sure many would found need doc incorrect data,20
599,MDL-43175,Base event JSON encoding decoding check will fail with whole float values.,done ensure event field contain object field float whole number e g result number returned integer comparison done fail solution comparison strict catch suffice see class event base line,5
600,MDL-43178,"Incorrect confirmation message appears on ""per-forum digest option"" screen",able manage digest different within course via forum index id id course id digest setting forum message briefly displayed change made message however always correct message correct default digest however three always display message choice complete,5
601,MDL-43188,Backport missing beep to 2.5 and 2.4,bug made,5
602,MDL-43196,After upgrading to 2.6 my email-based-self-registration serves up an error when I click on 'Create New User' on the front page,use based self registration register site click create new user front page error invalid user site everything worked great replication navigate site user profile click create new profile field select text area set display page yes navigate site authentication manage authentication ensure based self registration default enable self registration open new browser student click log link top right corner click create new account behaviour new account user profile possible result following error shown invalid user information error select id user id array error code stack trace line thrown line call line call line editor call instance line editor class call line editor call line editor call line form editor call line pear renderer tableless call line call line pear element call line pear call accept line call accept line pear call accept line pear common call line pear call display line call display line login call display rest site work great error,2
603,MDL-43197,Parent role only sees course total and no longer individual grades,parent role see course total child user report whereas previously could see individual grade course capability reproduce rather long unfortunately teacher create two course grade specific student verify see separately student create parent role moodle en add user student graded parent add block front page log parent click name student block student profile click name course administration profile student name click activity grade course total shown individual assignment,20
604,MDL-43213,behat config settings and init code can be simplified,testing recently confused later even looking code attempt simplify always require cleanup script code require test remove switch completely part print script test test site manually,8
605,MDL-43215,Adding web service token generates alternate names debugging message ,visit section click add see message regarding alternate name need update include additional name user object line call line call line call definition line call,3
606,MDL-43238,Improve event php doc to include other information,event doc include information base information event specific event read documentation looking proposal fig fig fig pull also suggest similar documentation make core handbook documentation documentation,13
