,issuekey,title,description,storypoint
838,MDL-45754,Backup and restore of logs in 2.7 and above,new logging support backup restore,100
839,MDL-45772,"Some forms with passwords and usernames get populated by the browser, which is not desired",tried create new group course password group id password group step create group course step look group id password password colleague log machine colleague logged machine else cache logged back,20
840,MDL-45780,"Neither formchangechecker, nor quiz autosave detects changes in Atto editors",quiz code quiz require special code work need special code work one written reproduce quiz optional add array quiz array make easier test second delay change auto save ensure default set another editor create quiz one essay question editor file picker response type attempt quiz open console code useful tell going assuming developer type something verify later whatever delay set request add image verify cause reproduce go form click make new post type x message box click back button get warning leave page unsaved data,13
841,MDL-45827,Specify the requirements for the element library,dev page element library tool developer would add renderable renderer method tool list mandatory optional tool order meet moodle dev,5
842,MDL-45828,Create the element library admin tool,implement tool defined,8
843,MDL-45829,Define the initial list of renderables to be added to the element library,built smaller structured smaller need agreed describe category early list defined moodle dev list need,20
844,MDL-45830,Define style guide for renderables,document go hand hand element library define best follow default see moodle dev,40
845,MDL-45833,Debugging error when changing roles in category,following message code inconsistent context combination line class event base call line override call core event base create code replicate open course category click select role advanced change permission create related improvement trigger event inside,5
846,MDL-45853,Document renderer best practices,part render library specification moodle dev agree best document creation include writing render best output cannot used,20
847,MDL-45854,Define and document JavaScript output guide,part render library specification moodle dev need establish relationship output exist want use want use process thoroughly also consider document ship,40
848,MDL-45862,Convert existing displays to renderers,make forum layout easier clearer need create number may necessary break task smaller focus thread list,100
849,MDL-45885,Decide and document output components,essential part task unfortunately broad choose commit live meet need future need factor element component use use key approach want want change element want change reflected element within require look different way style button instantly look across like search button complex need easy write feature full limited number write instead available render change element must easy robust use key per point however need achieve way introduce magic keep simple understand override able deal state attribute element relation parent component way state component owner render method keep understandable,40
850,MDL-45893,Developing a User Menu,user menu refer specification know contain implement general approach support multiple without adversely affecting dom structure would necessitate every theme update user menu fine current solution quite encapsulate everything need happen particular stuff handled solution really make sense stuff live update turned huge new renderable extension renderable user course page array present thing sense set guest flag new renderable easily displayed base based well minor bug code fixed brief logic looking attribute node e target instead node event actually wired e extended way also ability assign suffix necessary u avoid renderer order support multiple collapsible necessary create entire renderable body header element collection bootstrap allow multiple responsive provided,100
851,MDL-45894,For students: a single page with all their course grades on it,create page wherein student able see currently visible user context page order avoid sudden navigation complete link page added user menu,20
852,MDL-45897,Add more blocks to the default 'my home' page,content home refer spec moodle dev information,13
853,MDL-45916,Event monitor: Finalise the basic file and database structure,commit basic file structure following directory structure access,20
854,MDL-45918,Event monitor: Create a rule manager class with unit tests,create class create edit delete get get rule unit,13
855,MDL-45919,Event monitor: Create a subscription manager class,create class create delete get subscription get course get event unit,20
856,MDL-45920,Define Report Builder API,work progress moodle dev need define used define report determine large section work need done integrate report builder core moodle,20
857,MDL-45935,Slow behat tests for backup,run backup pas table code backup course course code call passing turn backup process looking page page following fill form code code option table since found one page wait search option fail found ignore try catch moodle moodle blob master backup result test good minute fill page backup form three making wasted time fixing able knock good,5
858,MDL-45936,The auth/db plugin should use the core functions user_create_user and user_update_user,bunch logic add update user great want keep logic one place easy maintenance,8
859,MDL-45938,Event monitor: Create a form to edit/add a new rule,need form add edit new rule issue proper edit forum module update select drop dynamically consider dependent select element instead,40
860,MDL-45939,Event monitor: Create rule class,need class rule might following subscription class consider abstraction,20
861,MDL-46016,Shibboleth contains misleading comment regarding user passwords,reading shibboleth code found shibboleth index near line code find shibboleth attribute save session return main login page empty shibboleth auto login new password random password first base user id password never used unless user account converted manual code problem believe random short could yield extremely short instance first ted certainly security expert site whatever reason decided stop shibboleth anyone could stick bunch known easily first like bunch garbage would better idea use really hope missing something,13
862,MDL-46022,Add ability to create dividers in custom_menu,based code think useful ability create regular able specify like moodle community moodle moodle free support moodle support moodle development moodle development moodle tracker tracker moodle moodle moodle moodle news moodle news moodle company moodle commercial hosting moodle hosting moodle commercial support moodle support menu item text given class divider render time use character conflict use denote level,3
863,MDL-46035,Survey activity shows wrong error message to admins,create survey activity enrolled course submit guest,2
864,MDL-46036,Exception is thrown if you try to download responses from a survey activity with no responses,suspect handling data graceful way create survey activity click pick excel following displayed quote survey yet information error error code stack trace line thrown line survey call quote,5
865,MDL-46058,Include YUI -proxy modules in rollup,raised moodle forum post reply insane antiquated blocking based suspect see china north help include proxy longer blocked hopefully work,3
866,MDL-46059,Editing LTI page invalid grade view,edit page grade maximum decimal number integer try save,8
867,MDL-46109,Event monitor: Create a class to generate eventlist,create class find list,13
868,MDL-46110,Event monitor: Create renderables/renderers to display the rule managment page,write renderer display rule management interface,20
869,MDL-46111,Event monitor: Create renderables/renderers to display the subscription managment page,write renderer display subscription management interface,40
870,MDL-46118,"Problems in downloading course log files, only 30 lines are downloaded",hi problem trying log included file talking course administration even without filtering anything available click table data excel think really bug,5
871,MDL-46129,Event monitor: Handle creating/deleting subscriptions,write renderer display subscription management interface,13
872,MDL-46130,Event monitor: Handle rule managment,write handle rule rule,8
873,MDL-46131,Event monitor: Sort out navigation,basically going provide three main entry subscription management page management page sort need present navigation,8
874,MDL-46132,Event monitor: Implement the event observer,implement event observer,40
875,MDL-46133,Event monitor: Implement cron task to clean events table,implement task clean periodically three way truncate table unconditionally every x implement smart logic various event useful implement semi smart logic maximum used every thing beyond acceptable ideal easiest implement performance friendly,20
876,MDL-46134,Event monitor: Implement cron task to send notifications,implement task check rule send also include new message type,13
877,MDL-46139,"Add extra credit, drop-low/ keep-high, accurate weights and contribution column to User report",calculate container category course weight percentage associated need weighting could done next step calculate must first cannot calculate starting highest course include hidden set ignore ungraded set apply calculating total setup screen include extra credit ignore drop low keep high accumulate parent category calculate must done calculating starting highest course weight always percentage grade weight case percentage item container container step weight weight container step adjust container always equal calculate order accurately drop keep highest also provide starting highest course contribution always item percentage item weight container weight item weight container weight limit drop keep highest need order accurately drop low keep high remove remove parent remove parent,40
878,MDL-46175,Gradebook terminology improvements,defined working group en pack aggregate non empty exclude empty setup marking grading whenever stuff pack quiz swap string update grader report save new natural weighting,8
879,MDL-46181,Usability improvements for grade export and import,export optionally linked grader report would contain row row maximum would contain blank row category teacher add support letter well import excel paste import data via copy paste excel text field entry option instead file trouble saving file file preview user friendly right resilient preview file input data file moodle submit preview diagnosis data user know potential user invalid student invalid grade duplicate continue import moodle decided allow full perfect half data leave user confused lost idea data table allow user fix data right,100
880,MDL-46191,Develop new Gradebook history report,take grade history module integrate extend module provide functionality find provide report specific period time current,100
881,MDL-46206,Alt image in footer is incorrectly repeated,according example alt attribute footer image empty instead repeated twice image alt attribute p tag text maybe image displayed via replication log course inspect icon link bottom page,5
882,MDL-46218,Disabled functionality checks occur later than necessary,scouting around edit delete include check code empty code quite way file page set user loaded course loaded capability check could done much save u likely also true look around,5
883,MDL-46241,Event monitor: Create a subscription instance class,create class subscription instance,5
884,MDL-46248,Backport of MDL-42869: HTML validation check fails on calendar add event screen,issue would allow u apply fix,3
885,MDL-46253,"Add-on validation message always shows ""foundlangfile"" (Debug)",message module moodle interface add package validation page display message status like something wrong file tool class line incorrect self correct self sure setting done reason,3
886,MDL-46255,Purge all caches page did not call $PAGE->set_url(...) (Moodle 2.8),page call page confirm line call line call line call line call line call line call line call line theme tiny layout default call line call include line call line theme tiny call header line call line call line call line call line call redirect,5
887,MDL-46269,Convert http embedded content to https on https sites where available,could thing e g someone back constant thing whenever add link note apache server choose automatically may similar functionality protocol relative option considered well example link example moodle example moodle finally filter could made,100
888,MDL-46285,Option to hide user_picture from screen readers,present way emit visible screen could flag renderable true set false renderable appropriate default behaviour backwards compatible current visible screen flag true emulate setting flag false hide screen,3
889,MDL-46313,Create new icons for e-mail subscription status,current e mail subscription state subtle go work creative magic bring u something beautiful inspiring see glance subscription state,8
890,MDL-46316,Fix coding style problems in notes,code checker currently,5
891,MDL-46346,coding style problems in blog,originally noted lot style,5
892,MDL-46352,Deprecate print_group_picture,support ongoing forum work helper renderable renderer solution output library,5
893,MDL-46401,Use cohorts to restrict display of course categories and set themes,problem moodle large many would like one moodle set user department theme department simple solution use represent allow cohort one course category one theme user logged know restrict entire course tree show anything inside one category could refine leaving name category content top level user also enrolled outside category simply appear list top level additionally one cohort theme also set theme match cohort theme setting theme thanks idea would suitable want tenancy moodle,100
894,MDL-46409,Event monitor: Consolidate and increase unit tests for the tool,number already incorporated event monitor issue review unit add additional greater coverage,40
895,MDL-46410,Event monitor: Implement a notification sent history report,write page display report sent,40
896,MDL-46455,Re-introduce backup/restore functionality with new logging system,currently new logging support backup restore critical information especially plan functionality exist removing usage legacy legacy log store new backing logging information,100
897,MDL-46496,jquery ui css issue,moodle come standard moodle found bug included normal file correct version extra path information image base removed left relative path folder problem exist master branch upgrade,3
898,MDL-46510,Event monitor: Delete rules when course is deleted,need observer delete course,8
899,MDL-46523,Add body class when logged in as other role,support work done need way telling dom level user another role already class added body telling u logged another user fairly straightforward,3
900,MDL-46546,CSV import of grades silently fails when malformed row(s) present,number data row match header row diagnostic warning ability map select box identify user section broken,13
901,MDL-46547,Copy and paste import from excel into the gradebook.,would convenient copy paste excel straight could added import form,100
902,MDL-46548,Improved interface for export of grades,add ability dump grade data without optionally linked grader report solution contain row row maximum contain blank row category teacher support letter well see,20
903,MDL-46549,Robust previewing + update dry running for importing grade CSVs,integrate file preview functionality preview file input data file moodle diagnosis data potential e change underlying also skip duplicate detail detail name found system key student name found group key invalid grade missing grade invalid scale value invalid grade value grade item name key duplicate grade name key grade name key grade name key warning accepted grade item maximum error grade item maximum error grade score locked grade error grade score grade error grade score invalid grade error grade score invalid group error grade score invalid student warning grade score duplicate score likely used wrong delimiter non grade value possibly wrong column,40
904,MDL-46567,Clone and integrate NetSpot's gradehistory report,pull module keep git history remove file add missing file complete fix style make sure comply moodle,8
905,MDL-46568,Clean up the history report,removing unnecessary unused removing language static cache check module security privacy access,8
906,MDL-46569,Migrate the history report to use table_sql,migrate table enable check column enable check collapsible implement autoloading different class use feature rather export button reconsider display order use make name grader graded grade item grader graded go profile grade item could go somewhere maybe source column page navigation displayed filter form,40
907,MDL-46570,Convert gradebook javascript to a YUI module,convert code shifter compatible module move logic class another location,40
908,MDL-46571,Write Unit Tests for the history report,write unit ensure result,20
909,MDL-46572,Write a simple behat test for the history report,write simple test history report quote teacher see grade history grade gave student quote,13
910,MDL-46573,Improve the SQL queries of the history report,fix query based id unit confirming ensure include alternate name ensure cross,13
911,MDL-46574,Add the event grade_report_viewed for the history report,create use new event event,13
912,MDL-46576,Implement Natural aggregation,include upgrade code add new may involve fixing unit must code checker,100
913,MDL-46577,"Restructure Unit tests for gradebook aggregation, include natural weight",need added based calculation section spec moodle dev written early prove state code also logic covered moodle dev particular sum aggregation must fixed exclude hidden exclude non graded determination range grader user report grade setup screen must fixed exclude extra credit unclear new functionality work new unit explain detail going vendor bin relevant need grade grade grade grading,40
914,MDL-46578,Make Natural aggregation the (single) default aggregation method,currently number aggregation new natural aggregation method cover functionality aggregation new set default aggregation method also possible hide aggregation setting single selected aggregation method site level defined site grade category one aggregation method available aggregation hidden setup wherever,8
915,MDL-46595,Add behat tests,base calculation section spec moodle dev written early prove state code also logic covered moodle dev particular sum aggregation must fixed exclude hidden exclude non graded determination range grader user report grade setup screen must fixed exclude extra credit write new new,40
916,MDL-46597,Locked grade items don't update on grade import,score student via import locked entire set update yet message effect current message notification grade locked problem score student via import locked entire set update yet message effect current message notification grade locked level major fix line code better error message line additional message print different error message please note text would go string extended solution print least line mismatch possibly process entire file list reproduce turn grader report manual grade item lock single score turn import data grade item ensure one student list see,13
917,MDL-46598,Robust handling of bad grade import data,data column bad value like letter import fail two different way instructor column data grade item need better diagnostic message instructor column new grade item import error,13
918,MDL-46599,Importing null grade data clears existing grades,instructor data file null instructor file null example real world scenario large class multiple grade subset grader may enter,40
919,MDL-46600,Import fails if grade import data contains nonexistent user,matching data file user even one record moodle entire import adequate diagnostic first user find tell instructor data,13
920,MDL-46602,Write specification for improvements to scales. ,need get agreement solution need properly specify solution spec moodle dev,20
921,MDL-46603,Improve grade_scale class to support mapping to/from points and menu generation.,way scale currently moodle activity implement logic list scale given scale menu chosen item via method scale use would much better single function responsible form element scale scale logic hard getting min scale converting scale item value getting list scale getting grade scale item getting scale item value extend grade encapsulate logic need unit,20
922,MDL-46604,Allow custom mappings of scale items -> points,extra column need added scale table optionally store scale column need used converting raw scale item bounded value see nice need made edit custom need unit,20
923,MDL-46605,Remove custom scales logic from modules.,need replace manual scale logic scale grade actually directly use scale,8
924,MDL-46606,Review use of scales in workshop.,workshop custom scale logic calculating average several scale call logic scale based index calculating average reason need understood decide handled,13
925,MDL-46607,Update advanced grading methods to support new scales mapping.,new method added controller specify particular scale used module function advanced grading must correctly map grade item scale supporting advanced grading tell scale used advanced grading controller see,20
926,MDL-46608,"Add an admin setting to make the use of a particular scale the ""default"" for all grading things (gradebook columns, activities etc).",wherever used equivalent,5
927,MDL-46609,Create an easy way to configure grade letters matching an existing scale. ,would convenience want sometimes use scale grading sometimes always want result vice,13
928,MDL-46646,Optimise grader report,whilst lot would expect easy address knock sub page load like unnecessary use loop repeat fetch user without repeated static string,8
929,MDL-46649,The user selector search does not respect the parameters passed,user selector loading searching next query per page page number therefore already present fetching blocked due transition structure,8
930,MDL-46658,Prepare and integrate grader code from UCLA,code view may accept core still need little bit work part issue merge relevant update meet style primarily move check produce definitive le set appropriate remove may,100
931,MDL-46661,Add dynamic loading of content,likely require removal pagination model content keeping track already loaded writing need also consider related functionality probably need come first dynamic searching dynamic,40
932,MDL-46662,Accessibility improvements for gradereport course header and aggregation controls.,provide accessibility screen specifically label course header indicate currently displayed alt text aggregation icon better indicate functionality,20
933,MDL-46663,Remove old functionality,note relate purely new functionality new way moodle class removed deprecation policy apply interface largely rewrite fixed system new method new method code,20
934,MDL-46678,Move sql in index.php to an api,index following code select u id u u user u join u id join id group u id order u u code need,5
935,MDL-46695,"Get prototype onto prototype.moodle.net, promote and request feedback",prototype checked possibly meet moodle prototype publicly opportunity feedback,8
936,MDL-46696,Implement backup and restore of the grades history,backup interface option include grade history anything providing user interface view grade history support backup restore data,40
937,MDL-46732,Review and move AJAX grading code to YUI module,interface default also pretty buggy looking currently surrounding trying establish whether want enable default move module currently exploratory work need discus whether something want default whether lead frequently moodle dev,40
938,MDL-46736,Handle grades associated with deleted grade items in the history report,query getting filter course id whenever grade item found course id would considered null thus used need update query handle grade possibly joining table rather one code git grade report history handle non grade code,20
939,MDL-46748,Mathjax default SSL CDN address is down causing atto to fail to load,moodle load forum post page failing load latest like gone plus side like got normal address moodle use latest instead completely fail load repository failure quite dramatic reproduce disable filter enable filter set latest working another broken try add forum post editor repository available actual editor load picker load,5
940,MDL-46772,html_writer::table Ignore attributes for rows,although take completely table function amongst addition data whole row,5
941,MDL-46774,Migrate row/column highlight code to YUI module,reduce code duplication improve performance reduce number event,5
942,MDL-46777,"Improve behaviour of grader header, footer and sidebar on iOS 8 + IE",issue grader report ie beta safari scroll event fired end action throughout issue tested beta safari scroll event fired throughout however fired frequently enough resulting stuttering feeling ie table large table dom without floating apparent reason stutter scroll event frequently enough like stuttering result tried several already present code highly number code also reduce layout thrashing one sense would nice use position fixed long standing known issue fixed gradually disappear screen far tell known fix fixed issue keep disappearing screen would maintain current solution relative positioned two ideal situation especially single ecosystem,5
